"","trail.id","trail.name","park.name","popularity","length","elevation.gain"
"1743",10294045,"Mount Sterling Backpacking Trail","Great Smoky Mountains National Park",2.1685,44417.784,2534.7168
"1744",10404669,"Long Bunk Trail via Mount Sterling Trail","Great Smoky Mountains National Park",2.139,16254.334,675.7416
"1745",10369466,"Goldmine, Forney and Noland Loop","Great Smoky Mountains National Park",2.0448,34278.942,1150.9248
"1746",10539892,"Appalachian Trail, Rocky Top, Eagle Creek and Lakeshore Trail","Great Smoky Mountains National Park",2.0029,52786.352,2147.9256
"1747",10333818,"Beech Flats Quiet Walkway","Great Smoky Mountains National Park",1.9921,2092.142,71.9328
"1748",10235667,"Cold Spring Gap Trail","Great Smoky Mountains National Park",1.9663,41681.906,2134.8192
"1749",10400232,"Cooper Creek Trail, Deeplow Gap Trail, Mingus Creek Trail, and Thomas Divide Trail Loop","Great Smoky Mountains National Park",1.9457,20277.684,853.7448
"1750",10332652,"Big Fork Ridge/Caldwell Fork/Boogerman/Caldwell","Great Smoky Mountains National Park",1.7236,13840.324,479.7552
"1751",10422498,"Sugarland Mountain and Huskey Gap Trail","Great Smoky Mountains National Park",1.6149,20116.75,225.8568
"1752",10352958,"Springhouse Branch Trail via Forney Ridge Trail","Great Smoky Mountains National Park",1.6121,26393.176,1284.732
"1753",10315779,"Fontana Dam to Cades Cove","Great Smoky Mountains National Park",1.5322,34439.876,1574.9016
"1754",10315058,"Benton MacKaye Trail: Smokemount to Big Creek","Great Smoky Mountains National Park",1.4293,47475.53,2512.7712
"1755",10375085,"Silers Bald via Lakeshore Trail, Bear Creek Trail, and Welch Ridge Trail","Great Smoky Mountains National Park",1.4108,57453.438,2370.7344
"1756",10486155,"Mt. Collins Shelter, Clingman/Forney Trail and Camp 68","Great Smoky Mountains National Park",1.3818,25588.506,1320.6984
"1757",10427729,"Forney Loop","Great Smoky Mountains National Park",1.1594,43291.246,1799.844
"1758",10503675,"Polls Gap-Rough Fork Tr to Caldwell Fork Tr","Great Smoky Mountains National Park",1.0623,15610.598,25.908
"1759",10236044,"Wind Canyon Trail","Theodore Roosevelt National Park",10.4755,804.67,16.764
"1760",10263868,"Caprock Coulee Loop","Theodore Roosevelt National Park",10.4163,6115.492,159.7152
"1761",10236045,"Painted Canyon Nature Trail","Theodore Roosevelt National Park",10.2914,1770.274,78.9432
"1762",10235012,"Petrified Forest Trail","Theodore Roosevelt National Park",9.4025,16415.268,253.8984
"1763",10235004,"Maah Daah Hey Trail","Theodore Roosevelt National Park",8.3048,229009.082,4614.9768
"1764",10236047,"Lower Paddock Creek Trail","Theodore Roosevelt National Park",7.0853,11587.248,127.7112
"1765",10269387,"Buck Hill Trail","Theodore Roosevelt National Park",6.9093,643.736,16.764
"1766",10236042,"Ridgeline Nature Trail","Theodore Roosevelt National Park",6.7009,1126.538,33.8328
"1767",10236043,"Coal Vein Trail","Theodore Roosevelt National Park",6.2267,965.604,4.8768
"1768",10236055,"Buckhorn Trail","Theodore Roosevelt National Park",6.1709,19633.948,324.9168
"1769",10236046,"Jones Creek Trail","Theodore Roosevelt National Park",6.03,11104.446,130.7592
"1770",10329957,"Boicourt Overlook Trail","Theodore Roosevelt National Park",5.7374,1287.472,18.8976
"1771",10292724,"Achenbach and North Achenbach Trail Loop","Theodore Roosevelt National Park",5.5844,29289.988,718.7184
"1772",10269386,"Old East Entrance Station Trail","Theodore Roosevelt National Park",5.2518,1448.406,7.9248
"1773",10443456,"Painted Canyon Trail","Theodore Roosevelt National Park",4.57,6920.162,134.7216
"1774",10291297,"The Big Plateau Trail","Theodore Roosevelt National Park",3.6341,9334.172,155.7528
"1775",10291317,"Lone Tree Spring Trail","Theodore Roosevelt National Park",3.4092,15449.664,193.8528
"1776",10239359,"Achenbach/Bison Trail Loop","Theodore Roosevelt National Park",3.2721,21887.024,483.7176
"1777",10347969,"East River Road to Scenic Loop Drive","Theodore Roosevelt National Park",2.9931,56005.032,879.9576
"1778",10291315,"Peaceful Valley Ranch Trails","Theodore Roosevelt National Park",2.8646,3057.746,2.7432
"1779",10291314,"Upper Talkinton Loop Trail","Theodore Roosevelt National Park",2.8597,16093.4,252.984
"1780",10291316,"Ekblom and Maah Daah Hey Trail","Theodore Roosevelt National Park",2.6486,24783.836,368.808
"1781",10236048,"Upper Paddock Creek Trail","Theodore Roosevelt National Park",2.2356,24783.836,357.8352
"1782",10032574,"Ledges Trail","Cuyahoga Valley National Park",29.5094,4184.284,46.9392
"1783",10235835,"Brandywine Gorge Trail","Cuyahoga Valley National Park",26.9381,2735.878,65.8368
"1784",10035195,"Stanford House to Brandywine Falls Trail","Cuyahoga Valley National Park",21.6423,6115.492,162.7632
"1785",10238254,"Blue Hen Falls Trail","Cuyahoga Valley National Park",21.3001,804.67,23.7744
"1786",10039328,"Salt Run Trail","Cuyahoga Valley National Park",18.232,6759.228,123.7488
"1787",10034704,"Plateau Trail","Cuyahoga Valley National Park",17.5775,7081.096,96.9264
"1788",10245164,"Pine Grove Trail and Ledges Trail Loop from Kendall Lake","Cuyahoga Valley National Park",15.0255,6115.492,98.7552
"1789",10272971,"Buckeye Trail to Valley Bridle Trail Loop","Cuyahoga Valley National Park",13.1825,5471.756,119.7864
"1790",10234182,"Wetmore Bridle Trail","Cuyahoga Valley National Park",12.9316,7563.898,169.7736
"1791",10257890,"Ohio and Erie Canal Towpath Trail: Brecksville Station","Cuyahoga Valley National Park",12.7516,7081.096,20.7264
"1792",10266197,"Buckeye Trail: Blue Hen to Jaite","Cuyahoga Valley National Park",12.2555,12391.918,304.8
"1793",10264336,"Buckeye Trail: Jaite to Brecksville Station","Cuyahoga Valley National Park",10.8471,12070.05,203.9112
"1794",10000147,"Boston Run Trail","Cuyahoga Valley National Park",10.5799,4988.954,70.7136
"1795",10243139,"Kendall Lake Loop","Cuyahoga Valley National Park",10.4444,1609.34,17.9832
"1796",10235836,"Pine Grove Trail","Cuyahoga Valley National Park",9.7454,3218.68,27.7368
"1797",10019479,"Buckeye Trail and Ohio & Erie Canal Towpath Loop","Cuyahoga Valley National Park",9.3625,5793.624,101.8032
"1798",10235844,"Oak Hill Trail","Cuyahoga Valley National Park",8.8946,2253.076,28.956
"1799",10344553,"Ledges Trail and Pine Grove Trail Loop","Cuyahoga Valley National Park",8.8828,5793.624,83.82
"1800",10306982,"Boston to Red Lock Loop via Buckeye Trail and Ohio and Erie Canal Towpath","Cuyahoga Valley National Park",8.8518,12552.852,235.9152
"1801",10310616,"Wetmore Outer Loop","Cuyahoga Valley National Park",8.6923,10621.644,243.84
"1802",10235841,"Tree Farm Trail","Cuyahoga Valley National Park",8.6766,4506.152,44.8056
"1803",10276110,"Riding Run Trail Loop","Cuyahoga Valley National Park",8.3952,6115.492,130.7592
"1804",10344781,"Ohio and Erie Canal Towpath: Peninsula to Boston Mills","Cuyahoga Valley National Park",7.7597,7724.832,25.908
"1805",10295028,"Perkins Trail and Riding Run Loop","Cuyahoga Valley National Park",7.2889,7724.832,164.8968
"1806",10300429,"Ohio and Erie Canal Towpath from Ira Trailhead","Cuyahoga Valley National Park",7.2361,4988.954,12.8016
"1807",10305108,"Ledges Trail Loop via Haskell Run Trail","Cuyahoga Valley National Park",6.9514,4023.35,86.868
"1808",10295083,"Furnace Run","Cuyahoga Valley National Park",6.7458,2735.878,73.7616
"1809",10240928,"Cross Country Trail from Quick Road","Cuyahoga Valley National Park",6.6676,5793.624,106.9848
"1810",10276946,"Cross Country Trail from Kendall Lake","Cuyahoga Valley National Park",6.4203,4667.086,72.8472
"1811",10344771,"Ohio and Erie Canal Towpath from Boston Mills to Peninsula","Cuyahoga Valley National Park",6.2907,7885.766,27.7368
"1812",10344762,"Ohio and Erie Canal Towpath: Red Lock to Peninsula","Cuyahoga Valley National Park",6.0376,14323.126,44.8056
"1813",10344879,"Buckeye Trail: Jaite to Boston","Cuyahoga Valley National Park",5.9747,16415.268,442.8744
"1814",10355894,"Twin Sister Falls","Cuyahoga Valley National Park",5.7656,2896.812,39.9288
"1815",10270881,"East Rim MTB Trail","Cuyahoga Valley National Park",5.366,3701.482,55.7784
"1816",10346689,"Wetmore, Lake and Salt Run Trail Loop ","Cuyahoga Valley National Park",5.0011,15610.598,318.8208
"1817",10320598,"Perkins Trail, Riding Run, and Furnace Trail Loop","Cuyahoga Valley National Park",4.9476,9173.238,239.8776
"1818",10342415,"Buckeye Trail to Bridle Trail Loop","Cuyahoga Valley National Park",4.6843,18668.344,384.9624
"1819",10344779,"Buckeye Trail and Ohio and Erie Canal Towpath Loop Extended","Cuyahoga Valley National Park",4.3587,11104.446,164.8968
"1820",10012275,"Haskell Run Trail","Cuyahoga Valley National Park",4.2816,1126.538,21.336
"1821",10348791,"Buckeye Trail: Short Loop","Cuyahoga Valley National Park",4.0185,3540.548,104.8512
"1822",10294673,"Valley Bridle Trail","Cuyahoga Valley National Park",3.7847,2896.812,101.8032
"1823",10344875,"Buckeye Trail and Bridle Trail Loop from Red Lock Trailhead","Cuyahoga Valley National Park",3.4967,9173.238,160.9344
"1824",10235837,"Forest Point Trail","Cuyahoga Valley National Park",3.3742,1287.472,11.8872
"1825",10406483,"Ohio and Erie Canal Towpath and Buckeye Trail Loop","Cuyahoga Valley National Park",3.3294,9334.172,114.9096
"1826",10406135,"Buckeye, West Highland Road, and Stanford Loop","Cuyahoga Valley National Park",3.1232,17059.004,354.7872
"1827",10270879,"Cuyahoga Valley Trail","Cuyahoga Valley National Park",2.7882,8207.634,89.916
"1828",10324329,"Hale Farm Connector to Ohio & Erie Canal Towpath Trail","Cuyahoga Valley National Park",2.7309,4988.954,41.7576
"1829",10376904,"Langes Run and Butlers Trail Loop","Cuyahoga Valley National Park",2.16,3057.746,61.8744
"1830",10307663,"Three Waterfalls Loop [PRIVATE PROPERTY]","Cuyahoga Valley National Park",1.8534,12070.05,242.9256
"1831",10235829,"Old Carriage Trail [CLOSED]","Cuyahoga Valley National Park",1.401,8529.502,105.7656
"1832",10000482,"Garfield Peak Trail","Crater Lake National Park",30.6183,5471.756,325.8312
"1833",10034294,"Cleetwood Cove Trail","Crater Lake National Park",27.0323,3379.614,189.8904
"1834",10038157,"The Watchman Peak Trail","Crater Lake National Park",24.347,2574.944,117.9576
"1835",10000879,"Mount Scott Trail","Crater Lake National Park",23.6165,6759.228,383.7432
"1836",10006702,"Discovery Point Trail","Crater Lake National Park",18.1556,6437.36,278.892
"1837",10249415,"Plaikni Falls Trail","Crater Lake National Park",17.582,3218.68,40.8432
"1838",10031540,"Wizard Island Trail","Crater Lake National Park",16.982,3701.482,228.9048
"1839",10016688,"Sun Notch Trail","Crater Lake National Park",13.9272,1287.472,38.7096
"1840",10249416,"Pinnacles Valley Trail","Crater Lake National Park",11.6493,1126.538,11.8872
"1841",10033225,"Mazama Village to Rim Village at Crater Lake","Crater Lake National Park",11.4577,13357.522,530.9616
"1842",10260669,"Crater Lake Rim Scenic Drive","Crater Lake National Park",11.2518,80788.868,1793.748
"1843",10013161,"Godfrey Glen Trail","Crater Lake National Park",8.8741,1770.274,19.812
"1844",10007903,"Crater Peak Trail","Crater Lake National Park",8.1223,11265.38,360.8832
"1845",10015976,"Annie Creek Canyon Trail","Crater Lake National Park",7.5299,3379.614,92.964
"1846",10012733,"Castle Crest Wildflower Garden Trail","Crater Lake National Park",7.0665,1931.208,36.8808
"1847",10008619,"Dutton Creek Trail","Crater Lake National Park",7.0416,7081.096,317.9064
"1848",10236072,"Lightning Spring Trail","Crater Lake National Park",6.9474,13518.456,395.9352
"1849",10309323,"Pacific Crest Trail and Alternate Loop","Crater Lake National Park",5.7241,49889.54,1211.8848
"1850",10236071,"Lady of the Woods Trail","Crater Lake National Park",4.5346,1126.538,33.8328
"1851",10311520,"Stuart Falls Trail","Crater Lake National Park",4.4797,18829.278,438.912
"1852",10339650,"Union Peak Trail","Crater Lake National Park",4.3161,15449.664,512.9784
"1853",10384539,"PCT: Crater Lake to Willamette Trailhead","Crater Lake National Park",2.2205,129551.87,3172.968
"1854",10023320,"Boardwalk Loop Trail","Congaree National Park",13.1392,3862.416,3.9624
"1855",10007467,"Weston Lake Loop Trail","Congaree National Park",9.6749,7402.964,4.8768
"1856",10236209,"Oakridge Trail","Congaree National Park",7.9083,10138.842,5.7912
"1857",10236213,"Congaree River Trail","Congaree National Park",6.6411,15932.466,15.8496
"1858",10111657,"Kingsnake Trail","Congaree National Park",5.9352,11909.116,6.7056
"1859",10236207,"Congaree Bluff Trail","Congaree National Park",5.1899,3379.614,5.7912
"1861",10451634,"Congaree River Blue Trail","Congaree National Park",1.6077,75317.112,1.8288
"1862",10235471,"Notch Trail","Badlands National Park",24.4547,2092.142,39.9288
"1863",10236013,"Castle Trail","Badlands National Park",18.9391,16898.07,95.7072
"1864",10036809,"The Door Trail","Badlands National Park",18.3365,1287.472,10.9728
"1865",10040859,"Saddle Pass Trail","Badlands National Park",14.4833,1126.538,65.8368
"1866",10021545,"Medicine Root Loop Trail","Badlands National Park",13.3928,7242.03,102.7176
"1867",10263286,"The Window Trail","Badlands National Park",11.4767,321.868,1.8288
"1868",10037874,"Cliff Shelf Nature Trail","Badlands National Park",10.903,804.67,19.812
"1869",10039409,"Fossil Exhibit Trail","Badlands National Park",10.1655,643.736,3.9624
"1870",10026500,"Rankin Ridge Interpretive Trail","Wind Cave National Park",9.5257,1609.34,72.8472
"1871",10018051,"Wind Cave Canyon Trail","Wind Cave National Park",7.6514,6115.492,64.9224
"1872",10028191,"Lookout Point Trail and Centennial Trail Loop","Wind Cave National Park",7.1351,8368.568,156.972
"1873",10036805,"Cold Brook Canyon Trail","Wind Cave National Park",6.4452,4506.152,60.96
"1874",10033733,"East Bison Flats Trail","Wind Cave National Park",4.9569,16254.334,445.9224
"1875",10037873,"Boland Ridge Trail","Wind Cave National Park",4.8794,7724.832,248.7168
"1876",10448920,"Sage Creek Loop","Badlands National Park",4.8456,36692.952,245.9736
"1877",10312492,"Centennial Trail: Highway 87 to Highlander Rd","Wind Cave National Park",4.4925,13035.654,286.8168
"1878",10354442,"Sheep Mountain Table Road","Badlands National Park",4.4132,23496.364,180.7464
"1879",10028190,"Elk Mountain Interpretive Trail","Wind Cave National Park",3.4866,4023.35,99.9744
"1880",10333773,"Prairie Vista Loop","Wind Cave National Park",3.3086,1609.34,31.6992
"1881",10236061,"Highland Creek Trail to Centennial Trail Loop","Wind Cave National Park",3.1247,21887.024,443.7888
"1882",10042715,"Alum Cave Trail to Mount LeConte","Great Smoky Mountains National Park",61.3755,17219.938,916.8384
"1883",10234019,"Chimney Tops Trail","Great Smoky Mountains National Park",49.5063,5793.624,392.8872
"1884",10000685,"Rainbow Falls Trail","Great Smoky Mountains National Park",45.0827,8851.37,503.8344
"1885",10002171,"Grotto Falls Trail","Great Smoky Mountains National Park",44.5689,4184.284,162.7632
"1886",10243771,"Laurel Falls Trail","Great Smoky Mountains National Park",39.9339,3862.416,120.7008
"1887",10233267,"Abrams Falls Trail","Great Smoky Mountains National Park",38.2789,7885.766,191.7192
"1888",10111322,"Charlies Bunion via Appalachian Trail","Great Smoky Mountains National Park",36.7769,13840.324,603.8088
"1889",10002866,"Ramsey Cascades Trail","Great Smoky Mountains National Park",31.48,13035.654,677.8752
"1890",10259284,"Peregrine Peak via Alum Cave Bluffs Trail","Great Smoky Mountains National Park",30.6655,6759.228,322.7832
"1891",10259229,"Spruce Flats Falls Trail","Great Smoky Mountains National Park",25.1986,2896.812,125.8824
"1892",10111932,"Porters Creek Trail","Great Smoky Mountains National Park",23.711,11265.38,460.8576
"1893",10026407,"Mount Cammerer via Low Gap Trail","Great Smoky Mountains National Park",23.5591,19151.146,965.9112
"1894",10040734,"Gatlinburg Trail","Great Smoky Mountains National Park",22.4946,6115.492,49.9872
"1895",10012354,"Laurel Falls and Cove Mountain","Great Smoky Mountains National Park",21.5393,12391.918,571.8048
"1896",10264089,"Jump Off Trail via Appalachian Trail","Great Smoky Mountains National Park",21.3524,9977.908,451.7136
"1897",10030861,"Cucumber Gap and Little River Loop Trail","Great Smoky Mountains National Park",21.0535,9012.304,241.7064
"1898",10040730,"Indian Flats Falls via Middle Prong Trail","Great Smoky Mountains National Park",19.5981,13035.654,389.8392
"1899",10259853,"Cades Cove Loop Road","Great Smoky Mountains National Park",18.8978,16254.334,210.9216
"1900",10036684,"Mount LeConte via Appalachian Trail and Boulevard Trail","Great Smoky Mountains National Park",18.4218,25105.704,1118.9208
"1901",10305945,"Cataract Falls","Great Smoky Mountains National Park",17.8727,1770.274,8.8392
"1902",10015520,"Gabes Mountain Trail to Hen Wallow Falls","Great Smoky Mountains National Park",17.7156,6920.162,296.8752
"1903",10234282,"Mount LeConte and Rainbow Falls via The Bullhead Trail","Great Smoky Mountains National Park",17.6183,20599.552,1184.7576
"1904",10259336,"Baskins Creek Trail and Baskins Creek Falls","Great Smoky Mountains National Park",16.5249,10299.776,529.7424
"1905",10111797,"Mount LeConte via Trillium Gap Loop Trail","Great Smoky Mountains National Park",16.3274,23979.166,1225.9056
"1906",10250846,"Icewater Spring via Appalachian Trail","Great Smoky Mountains National Park",15.6132,9977.908,415.7472
"1907",10241040,"Middle Prong Trail","Great Smoky Mountains National Park",15.5589,12713.786,381.9144
"1908",10111984,"Rocky Top from Lead Cove Trailhead","Great Smoky Mountains National Park",15.4833,16898.07,1177.7472
"1909",10033590,"Spruce Flats Falls via Lumber Ridge Loop","Great Smoky Mountains National Park",15.1321,11265.38,459.9432
"1910",10235587,"Roaring Fork Motor Nature Trail","Great Smoky Mountains National Park",14.9923,10782.578,365.76
"1911",10111542,"Gregory Ridge Trail to Gregory Bald","Great Smoky Mountains National Park",14.7105,18668.344,1023.8232
"1912",10029217,"Walker Sisters Home via Little Brier Gap Trail","Great Smoky Mountains National Park",14.7018,6276.426,134.7216
"1913",10235562,"Meigs Creek Trail","Great Smoky Mountains National Park",13.8054,10460.71,403.86
"1914",10262146,"Trillium Gap Trail to Grotto Falls","Great Smoky Mountains National Park",13.8012,10943.512,378.8664
"1915",10032533,"Little River Trail to Little River Upper Falls and Grouse Creek Campground","Great Smoky Mountains National Park",13.7139,19794.882,369.7224
"1916",10351769,"Myrtle Point and Mount LeConte via Alum Cave Trail","Great Smoky Mountains National Park",13.7108,18507.41,943.9656
"1917",10253465,"Look Rock Tower Trail","Great Smoky Mountains National Park",13.1739,1448.406,51.816
"1918",10235564,"West Prong Trail","Great Smoky Mountains National Park",13.1228,8046.7,414.8328
"1919",10111449,"Fighting Creek Nature Trail","Great Smoky Mountains National Park",13.0451,2253.076,37.7952
"1920",10274659,"Appalachian Trail: Newfound Gap to Sweat Heifer Creek Trail","Great Smoky Mountains National Park",12.9862,5310.822,262.7376
"1921",10042717,"Mount Sterling via Mount Sterling Gap","Great Smoky Mountains National Park",12.9028,8207.634,589.788
"1922",10008524,"Rich Mountain Loop Trail","Great Smoky Mountains National Park",12.7154,13357.522,606.8568
"1923",10040735,"Sugarlands Valley Nature Trail","Great Smoky Mountains National Park",12.5191,804.67,5.7912
"1924",10033605,"Maddron Bald Trail to Albright Grove Loop","Great Smoky Mountains National Park",12.4295,10621.644,443.7888
"1925",10258642,"Noah ""Bud"" Ogle Self-Guiding Trail","Great Smoky Mountains National Park",12.2624,1126.538,21.9456
"1926",10098025,"Appalachian Trail: Clingman Dome to Cades Cove","Great Smoky Mountains National Park",11.8531,38463.226,1036.9296
"1927",10037737,"Twin Creeks Trail","Great Smoky Mountains National Park",11.8255,7242.03,240.792
"1928",10033596,"Baskins Creek Falls Trail to Greenbrier Cove","Great Smoky Mountains National Park",11.7452,15771.532,559.9176
"1929",10318501,"Huskey Branch Falls","Great Smoky Mountains National Park",11.604,7563.898,116.7384
"1930",10255292,"Old Sugarlands Trail","Great Smoky Mountains National Park",11.4707,12070.05,382.8288
"1931",10260022,"Metcalf Bottoms Trail","Great Smoky Mountains National Park",11.3973,2414.01,56.9976
"1932",10278112,"Mount LeConte via Rainbow Falls Trail","Great Smoky Mountains National Park",11.2974,20921.42,1219.8096
"1933",10265630,"Rainbow Falls Trail and Cliff Tops Trail","Great Smoky Mountains National Park",11.2773,20277.684,1194.816
"1934",10033607,"Appalachian Trail: Davenport Gap to Max Patch","Great Smoky Mountains National Park",11.186,21404.222,1658.7216
"1935",10235691,"Schoolhouse Gap Trail","Great Smoky Mountains National Park",10.6726,7563.898,181.9656
"1936",10280663,"Meigs Creek Trail: Short Version","Great Smoky Mountains National Park",10.6605,5632.69,226.7712
"1937",10111624,"Injun Creek Trail","Great Smoky Mountains National Park",10.6371,11104.446,447.7512
"1938",10010713,"Anthony Creek Leadbetter Ridge Loop Trail","Great Smoky Mountains National Park",10.1108,20760.486,988.7712
"1939",10242506,"Myrtle Point via Appalachian Trail and Boulevard Trail","Great Smoky Mountains National Park",10.0742,25266.638,1130.808
"1940",10266181,"Jakes Creek Trail to Avent Cabin","Great Smoky Mountains National Park",9.886,4345.218,146.9136
"1941",10292939,"Mount Le Conte","Great Smoky Mountains National Park",9.84,20116.75,993.9528
"1942",10111792,"Chestnut Branch Trail to Mount Cammerer","Great Smoky Mountains National Park",9.4908,16254.334,1005.84
"1943",10111329,"Chestnut Top Trail to Whiteoak Sink","Great Smoky Mountains National Park",9.1408,16254.334,602.8944
"1944",10279123,"Brushy Mountain","Great Smoky Mountains National Park",9.0862,10138.842,528.828
"1945",10284971,"Lynn Camp Via Middle Prong Trail","Great Smoky Mountains National Park",8.9789,7081.096,156.972
"1946",10042714,"Cove Hardwoods Nature Trail","Great Smoky Mountains National Park",8.8013,1287.472,62.7888
"1947",10260510,"Newfound Gap Road Drive","Great Smoky Mountains National Park",8.7671,47314.596,1191.768
"1948",10258633,"Elkmont Nature Trail","Great Smoky Mountains National Park",8.6952,1287.472,28.956
"1949",10270730,"Jakes Creek via Miry Ridge Trail and Appalachian Trail Loop","Great Smoky Mountains National Park",8.6346,40555.368,1551.7368
"1950",10235575,"Mt. Sterling via Baxter Creek Trail","Great Smoky Mountains National Park",8.6205,18829.278,1255.776
"1951",10039311,"Lower Mount Cammerer Trail","Great Smoky Mountains National Park",8.5794,23335.43,578.8152
"1952",10245065,"Elijah Oliver Place Trail","Great Smoky Mountains National Park",8.5405,1931.208,29.8704
"1953",10353236,"Rocky Top via Anthony Creek Trail","Great Smoky Mountains National Park",8.2347,18829.278,1118.9208
"1954",10276323,"Newfound Gap to Indian Gap","Great Smoky Mountains National Park",8.2339,5310.822,256.9464
"1955",10235696,"Grapeyard Ridge Trail","Great Smoky Mountains National Park",8.2144,23174.496,980.8464
"1956",10235671,"Huskey Gap Trail","Great Smoky Mountains National Park",8.081,6115.492,381
"1957",10038786,"Brushy Mountain Trail","Great Smoky Mountains National Park",7.9799,18024.608,933.9072
"1958",10306112,"Courthouse Rock Trail","Great Smoky Mountains National Park",7.9205,3540.548,220.98
"1959",10234202,"Jakes Creek and Lynn Camp Prong","Great Smoky Mountains National Park",7.8314,27036.912,1195.7304
"1960",10294985,"Riverview Quiet Walkway","Great Smoky Mountains National Park",7.8171,1448.406,42.9768
"1961",10012885,"Sugarland Mountain Trail","Great Smoky Mountains National Park",7.6716,18829.278,1347.8256
"1962",10011050,"Little Bottoms Trail","Great Smoky Mountains National Park",7.6537,11104.446,289.8648
"1963",10008136,"Appalachian Trail: Fontana Lake to Mount Squires","Great Smoky Mountains National Park",7.612,24622.902,1590.7512
"1964",10235590,"Curry Mountain Trail","Great Smoky Mountains National Park",7.41,10299.776,391.9728
"1965",10111543,"Gregory's Little Bald Trail","Great Smoky Mountains National Park",7.3672,16093.4,777.8496
"1966",10028074,"Cosby Self-Guided Nature Trail","Great Smoky Mountains National Park",7.2537,1770.274,47.8536
"1967",10111867,"Old Sugarlands, Twin Creeks, Gatlinburg Loop Trail","Great Smoky Mountains National Park",7.0751,16093.4,465.7344
"1968",10244630,"Metcalf Bottoms Trail to Laurel Falls","Great Smoky Mountains National Park",7.0488,19794.882,936.9552
"1969",10030871,"Gabes Mountaun, Maddron Bald and Snake Den Ridge Loop","Great Smoky Mountains National Park",6.9591,27358.78,1302.7152
"1970",10030854,"Finley Cane Trail","Great Smoky Mountains National Park",6.9441,8368.568,190.8048
"1971",10033603,"Old Settlers Trail","Great Smoky Mountains National Park",6.7327,26071.308,1052.7792
"1972",10235689,"Lead Cove Trail","Great Smoky Mountains National Park",6.648,5310.822,353.8728
"1973",10030856,"Lead Cove and Finley Cane Trail","Great Smoky Mountains National Park",6.6385,10782.578,446.8368
"1974",10242204,"Thunderhead Prong Quiet Walkway","Great Smoky Mountains National Park",6.5052,2092.142,64.9224
"1975",10349553,"Whiteoak Sinks","Great Smoky Mountains National Park",6.4908,7081.096,194.7672
"1976",10299002,"Mount Cammerer Loop - Low Gap and Lower Cammerer","Great Smoky Mountains National Park",6.0457,26071.308,1050.9504
"1977",10235566,"Little River and Goshen Prong Trail","Great Smoky Mountains National Park",6.0372,21726.09,1363.98
"1978",10112071,"Snake Den Ridge Low Gap Trail","Great Smoky Mountains National Park",5.9696,20438.618,1199.9976
"1979",10111114,"Rabbit and Abrams Creeks Loop Trail","Great Smoky Mountains National Park",5.9314,24461.968,1219.8096
"1980",10259293,"Appalachian Trail: Newfound Gap to Fontana Lake","Great Smoky Mountains National Park",5.8673,61637.722,2461.8696
"1981",10235663,"Meigs Mountain Trail","Great Smoky Mountains National Park",5.8096,14805.928,450.7992
"1982",10235661,"Bote Mountain Trail","Great Smoky Mountains National Park",5.7249,21404.222,1050.9504
