"","trail.id","trail.name","park.name","popularity","length","elevation.gain"
"1",10020048,"Harding Ice Field Trail","Kenai Fjords National Park",24.8931,15610.598,1161.8976
"3",10267857,"Exit Glacier Trail","Kenai Fjords National Park",17.7821,2896.812,81.9912
"30",10187810,"Bright Angel Trail to Bright Angel Campground and River Trail","Grand Canyon National Park",37.4791,28485.318,1525.8288
"31",10016964,"South Kaibab Trail to Cedar Ridge","Grand Canyon National Park",36.2709,4988.954,358.7496
"32",10237812,"Three-Mile Resthouse via Bright Angel Trail","Grand Canyon National Park",33.256,8690.436,635.8128
"33",10245012,"South Kaibab, Phantom Ranch, and Bright Angel Trail Loop ","Grand Canyon National Park",31.6323,26875.978,1400.8608
"34",10265905,"South Kaibab Trail to Ooh Aah Point","Grand Canyon National Park",28.8685,2896.812,210.9216
"35",10266148,"Grand Canyon Rim Trail","Grand Canyon National Park",28.2035,8690.436,106.9848
"36",10094721,"Rim-to-Rim: North Kaibab to Grand Canyon Village","Grand Canyon National Park",24.0229,34761.744,1614.8304
"37",10026816,"Shoshone Point Trail","Grand Canyon National Park",22.7206,3379.614,45.72
"38",10235665,"Plateau Point Trail via Bright Angel Trail","Grand Canyon National Park",22.5006,19633.948,961.9488
"39",10266521,"South Kaibab Trail to Skeleton Point","Grand Canyon National Park",22.1688,8690.436,602.8944
"40",10016127,"Grand Canyon West Rim Trail","Grand Canyon National Park",21.652,20599.552,169.7736
"41",10034910,"Bridal Wreath Falls Trail","Saguaro National Park",20.8545,9012.304,326.7456
"42",10337353,"1.5 Mile Resthouse via Bright Angel Trail","Grand Canyon National Park",20.0835,4667.086,349.9104
"43",10013850,"Bright Angel Point Trail","Grand Canyon National Park",19.8228,1448.406,43.8912
"44",10031380,"Wasson Peak Trail","Saguaro National Park",18.8699,12713.786,567.8424
"45",10304374,"Indian Garden via Bright Angel Trail","Grand Canyon National Park",16.7412,13196.588,896.7216
"46",10236025,"Blue Mesa Trail","Petrified Forest National Park",15.5733,1448.406,32.9184
"47",10013966,"King Canyon Trail to Wasson Peak","Saguaro National Park",15.5,11426.314,560.832
"48",10004120,"Grandview Trail Loop","Grand Canyon National Park",14.8144,18668.344,1188.72
"49",10006500,"Hermit Trail","Grand Canyon National Park",14.7746,24783.836,1567.8912
"50",10259347,"Grandview Point to Horseshoe Mesa Trail","Grand Canyon National Park",14.7248,8851.37,726.948
"51",10041313,"North Kaibab Trail to Roaring Springs","Grand Canyon National Park",14.6866,13518.456,1071.9816
"52",10244240,"Wasson Peak via Sweetwater Trail","Saguaro National Park",14.3846,14966.862,637.9464
"53",10111405,"Douglas Spring Trail","Saguaro National Park",14.3478,26715.044,1139.952
"54",10286650,"South Kaibab Trail to Phantom Ranch","Grand Canyon National Park",13.8468,21565.156,1496.8728
"55",10031336,"Widforss Trail","Grand Canyon National Park",13.3343,14644.994,315.7728
"56",10031337,"Transept Trail","Grand Canyon National Park",12.6285,4667.086,85.9536
"57",10304469,"Yavapai Point via Rim Trail","Grand Canyon National Park",12.5954,2574.944,24.9936
"58",10273263,"Bright Angel Trail: South Rim to Phantom Ranch","Grand Canyon National Park",12.4801,28968.12,1518.8184
"59",10000811,"Cape Royal Trail","Grand Canyon National Park",12.4222,1609.34,19.812
"60",10009957,"Rim-to-Rim: North Kaibab to South Kaibab Trailhead","Grand Canyon National Park",12.4044,31060.262,1666.9512
"61",10006953,"Tanque Verde Ridge Trail","Saguaro National Park",12.393,32186.8,1705.9656
"62",10297089,"Rim to Rim Trail Segment: Indian Garden to Colorado River","Grand Canyon National Park",12.3532,9656.04,429.768
"63",10040243,"North Kaibab Trail to Colorado River","Grand Canyon National Park",12.302,45061.52,2092.7568
"64",10026822,"Cape Final","Grand Canyon National Park",12.0834,6437.36,150.876
"65",10242023,"Mica View Loop Trail","Saguaro National Park",11.8629,5954.558,36.8808
"66",10255289,"Phantom Ranch to Ribbon Falls via North Kaibab Trail","Grand Canyon National Park",11.8608,19151.146,592.836
"67",10004435,"Hugh Norris Trail","Saguaro National Park",11.8001,14323.126,729.996
"68",10258667,"North Kaibab Trail to Supai Tunnel and Coconino Overlook","Grand Canyon National Park",11.7107,5954.558,425.8056
"69",10236026,"Crystal Forest Trail","Petrified Forest National Park",11.5545,1448.406,10.9728
"70",10258648,"Hermit's Rest Viewpoint  to Santa Maria Spring","Grand Canyon National Park",11.1051,5471.756,528.828
"71",10257085,"South Kaibab to North Kaibab to Bright Angel Trail","Grand Canyon National Park",11.0836,65822.006,3578.9616
"72",10236022,"Painted Desert Rim Trail","Petrified Forest National Park",10.9378,1770.274,11.8872
"73",10018269,"Petrified Forest Scenic Drive","Petrified Forest National Park",10.9165,46027.124,297.7896
"74",10265749,"Bright Angel Trail to Phantom Overlook to South Kaibab Trail","Grand Canyon National Park",10.8324,27841.582,1748.9424
"75",10315767,"South Kaibab Trail to Tip Off","Grand Canyon National Park",10.6545,14484.06,1004.9256
"76",10023828,"Grand Canyon South Rim Scenic Drive: Cameron to Grand Canyon Village","Grand Canyon National Park",10.3784,88513.7,1601.724
"77",10112001,"Safford Peak Trail","Saguaro National Park",10.3328,3862.416,278.892
"78",10042232,"Thunder Creek to Deer Creek and Thunder Falls","Grand Canyon National Park",10.2641,46670.86,2213.7624
"79",10365390,"Rim to Rim: North to South and Ribbon Falls","Grand Canyon National Park",10.1704,49889.54,1995.8304
"80",10267208,"Gould Mine","Saguaro National Park",10.0467,3701.482,115.824
"81",10293249,"Douglas Spring, Bridal Wreath Falls, Three Tank, Garwood Loop","Saguaro National Park",9.9618,11426.314,381.9144
"82",10258317,"Grand Canyon Rim Village to Hermit's Rest","Grand Canyon National Park",9.9197,24622.902,424.8912
"83",10002324,"Desert View Visitor Center Trail","Grand Canyon National Park",9.7326,643.736,10.9728
"84",10274527,"Coconino Overlook","Grand Canyon National Park",9.609,2092.142,141.732
"85",10009628,"Uncle Jim Trail","Grand Canyon National Park",9.5621,7563.898,222.8088
"86",10009444,"Dripping Springs via Dripping Springs and Hermit Trail","Grand Canyon National Park",9.227,10138.842,796.7472
"87",10251377,"Giant Logs Trail","Petrified Forest National Park",9.1802,965.604,10.9728
"88",10042018,"Onyx Bridge Trail","Petrified Forest National Park",8.7642,7402.964,134.7216
"89",10331092,"North Kaibab Trail to Redwall Bridge","Grand Canyon National Park",8.6888,11104.446,801.9288
"90",10002217,"Valley View Overlook Trail","Saguaro National Park",8.6324,1287.472,14.9352
"91",10041071,"Cactus Forest Loop Drive","Saguaro National Park",8.6024,16576.202,213.9696
"92",10236028,"Long Logs and Agate House Loop Trail","Petrified Forest National Park",8.5243,3379.614,24.9936
"93",10259343,"Tanner Trail","Grand Canyon National Park",8.5202,21404.222,1611.7824
"94",10306310,"Loma Verde and Squeeze Pen Loop","Saguaro National Park",8.4605,5954.558,47.8536
"95",10039522,"Hope Camp","Saguaro National Park",8.2704,10460.71,160.9344
"96",10304719,"South Kaibab, Tonto and Bright Angel Trail","Grand Canyon National Park",8.2646,19955.816,1034.796
"97",10032774,"Garwood Trail","Saguaro National Park",8.2525,5310.822,61.8744
"98",10111504,"Garwood Dam To Douglas Spring Loop Trail","Saguaro National Park",7.9559,10460.71,345.948
"99",10246734,"South to North Kaibab Trail","Grand Canyon National Park",7.7075,31060.262,1966.8744
"100",10281018,"Tanque Verde Ridge","Saguaro National Park",7.7075,5310.822,281.94
"101",10038311,"Freeman Homestead Nature Trail","Saguaro National Park",7.6339,1770.274,32.9184
"102",10258602,"Point Imperial","Grand Canyon National Park",7.5684,160.934,6.7056
"103",10011949,"Sendero Esperanza Trail","Saguaro National Park",7.5414,8046.7,316.992
"104",10298010,"Douglas Spring to Three Tank Trail Junction","Saguaro National Park",7.479,7242.03,295.9608
"105",10302747,"West Rim Trail: Hermits Rest to Powell Point","Grand Canyon National Park",7.4072,19312.08,231.9528
"106",10259900,"Saguaro National Park West and Old Tucson Studios Scenic Drive","Saguaro National Park",7.2569,63086.128,657.7584
"107",10235597,"Roosevelt Point Trail","Grand Canyon National Park",7.2201,482.802,0.9144
"108",10311930,"Petroglyphs at King Canyon","Saguaro National Park",7.1664,3540.548,88.6968
"109",10013382,"South Bass Trail","Grand Canyon National Park",7.1647,19633.948,1330.7568
"110",10236023,"Puerco Pueblo Trail","Petrified Forest National Park",7.0465,482.802,2.7432
"111",10111280,"Cactus Forest Trail","Saguaro National Park",7.0254,16093.4,155.7528
"112",10258739,"The Escalante Route Trail","Grand Canyon National Park",6.9609,56005.032,2881.884
"113",10023951,"Nankoweap Trail","Grand Canyon National Park",6.9456,49406.738,2568.8544
"114",10270136,"Devil's Playground Loop","Petrified Forest National Park",6.9205,12070.05,144.78
"115",10287374,"Pink Hill, Loma Verde, Cholla Trail, and Cactus Forest Loop","Saguaro National Park",6.8368,5310.822,23.7744
"116",10272964,"Hermit Trail to Dripping Springs","Grand Canyon National Park",6.8325,8529.502,610.8192
"117",10035690,"Ridge View Trail","Saguaro National Park",6.7822,3701.482,106.9848
"118",10258650,"Cliff Springs Trail","Grand Canyon National Park",6.6276,1770.274,93.8784
"119",10258659,"Walhalla Overlook","Grand Canyon National Park",6.4591,160.934,0
"120",10258654,"Widforss Trail - Short Option","Grand Canyon National Park",6.3809,6920.162,179.832
"121",10315676,"Mica View Trail to Cactus Forest Trail","Saguaro National Park",6.3801,3057.746,20.7264
"122",10259353,"Clear Creek Trail","Grand Canyon National Park",6.3369,49245.804,2673.7056
"123",10039514,"Desert Ecology Trail","Saguaro National Park",6.2729,482.802,2.7432
"124",10013558,"New Hance Trail","Grand Canyon National Park",6.1769,20921.42,1506.9312
"125",10013912,"Bright Angel Trail to Tonto Trail","Grand Canyon National Park",5.9577,116838.084,3102.864
"126",10272375,"Old Jasper Forest Road","Petrified Forest National Park",5.9341,4184.284,53.9496
"127",10269962,"Wildhorse Trail","Saguaro National Park",5.8308,4988.954,91.7448
"128",10269284,"Tanque Verde Falls Viewpoint","Saguaro National Park",5.7938,1126.538,61.8744
"129",10259355,"Hermit's Rest Viewpoint to Tonto Trail to Bright Angel Trailhead","Grand Canyon National Park",5.7315,34118.008,1593.7992
"130",10013747,"Desert Discovery Nature Trail","Saguaro National Park",5.7162,643.736,4.8768
"131",10259354,"Boucher Trail to Hermit Trail Loop","Grand Canyon National Park",5.7123,32508.668,1758.696
"132",10112153,"Thunderbird Trail","Saguaro National Park",5.6144,6437.36,149.9616
"133",10389448,"Rim Trail, South Kaibab and Bright Angel Loop","Grand Canyon National Park",5.5548,34118.008,1501.7496
"134",10016910,"Mather Campground Trail","Grand Canyon National Park",5.4493,3701.482,36.8808
"135",10267209,"Cactus Wren Trail","Saguaro National Park",5.3994,6276.426,56.9976
"136",10259344,"Tonto Trail: New Hance Trail to Grandview Point","Grand Canyon National Park",5.3565,25105.704,1569.72
"137",10266285,"South to North Kalbab Trail","Grand Canyon National Park",5.2788,49728.606,3386.9376
"138",10297375,"Painted Desert Rim Trail to Kachina Point","Petrified Forest National Park",5.2572,1770.274,12.8016
"139",10013255,"Tusayan Ruin Trail","Grand Canyon National Park",5.2356,482.802,4.8768
"140",10269670,"Scenic, Passey, Packrat Trail Loop","Saguaro National Park",5.0684,2735.878,80.772
"141",10384519,"Ribbon Falls from the North Rim via North Kaibob Trail","Grand Canyon National Park",5.0517,27036.912,1639.824
"142",10263759,"Mica Mountain via Douglas Spring and Cow Head Saddle Trail","Saguaro National Park",5.05,40877.236,1961.9976
"143",10021291,"Redington OHV Trail","Saguaro National Park",5.0108,39267.896,750.7224
"144",10017278,"Boucher Trail","Grand Canyon National Park",4.9978,28485.318,1714.8048
"145",10268598,"Hope Camp Coyote Wash and Ruiz Trail Loop","Saguaro National Park",4.9944,9334.172,142.9512
"146",10235600,"Ken Patrick Trail North from Point Imperial","Grand Canyon National Park",4.9845,7885.766,143.8656
"147",10398395,"Tanque Verde Falls Beach","Saguaro National Park",4.8374,1287.472,29.8704
"148",10235592,"Grand Canyon Bridle Trail","Grand Canyon National Park",4.6675,5149.888,77.724
"149",10306312,"Shantz and Mica View Trail","Saguaro National Park",4.5595,4184.284,36.8808
"150",10259348,"Tonto Trail from Grandview Point to South Kaibab Trailhead","Grand Canyon National Park",4.557,43774.048,1589.8368
"151",10347292,"Phantom Ranch to Phantom Overlook","Grand Canyon National Park",4.4377,3379.614,205.74
"152",10258670,"Monument Point via Bill Hall Trail","Grand Canyon National Park",4.3741,2414.01,103.9368
"153",10272332,"Martha's Butte","Petrified Forest National Park",4.3654,4345.218,22.86
"154",10041333,"Coyote Pass Loop Trail","Saguaro National Park",4.3271,9173.238,159.7152
"155",10004062,"Waldron Trail","Grand Canyon National Park",4.324,7885.766,703.7832
"156",10018933,"Lava Falls Trail","Grand Canyon National Park",4.2213,4184.284,762.9144
"157",10037999,"Turkey Creek","Saguaro National Park",4.1951,19473.014,1199.9976
"158",10299272,"Cactus Canyon and Gila Monster Loop via Thunderbird Trail","Saguaro National Park",4.1854,9656.04,223.7232
"159",10111891,"Panther Peak Wash - Roadrunner Loop","Saguaro National Park",4.1242,6759.228,57.912
"160",10039029,"Manning Camp Trail","Saguaro National Park",4.0726,24783.836,1391.7168
"161",10263672,"Tanner Trail to Grandview Trail and Grandview Point","Grand Canyon National Park",4.0376,50855.144,2435.9616
"162",10378554,"Blue Hills Loop","Petrified Forest National Park",4.0307,3862.416,67.9704
"163",10327921,"Grandview Point to Horseshoe Mesa East Trail","Grand Canyon National Park",4.0154,11748.182,833.9328
"164",10304376,"Tonto Trail to Monument Creek","Grand Canyon National Park",4.0014,45544.322,1603.8576
"165",10272356,"Martha's Butte Off-Trail Route","Petrified Forest National Park",3.9609,3057.746,17.9832
"166",10311730,"Vertical Cliffs Trail to Abington Trail Loop","Saguaro National Park",3.9491,6115.492,76.8096
"167",10028602,"Bajada Loop Drive","Saguaro National Park",3.7293,8368.568,129.8448
"168",10272764,"Hope Campe, Ruiz Trail, and Coyote Wash Trail","Saguaro National Park",3.7194,9012.304,139.9032
"169",10307988,"Wild Horse to Garwood Dam","Saguaro National Park",3.6987,6276.426,100.8888
"170",10111287,"Cam-Boh Trail","Saguaro National Park",3.4699,7885.766,69.7992
"171",10379267,"Hermit Trail to Granite Rapids Campground","Grand Canyon National Park",3.2761,35244.546,1748.9424
"172",10272205,"Tanner Beach and Lava Rapids Trail","Grand Canyon National Park",3.2356,31864.932,1724.8632
"173",10028565,"Ken Patrick Trail South from Point Imperial","Grand Canyon National Park",3.2283,15610.598,376.7328
"174",10313180,"Shantz, Mesquite, Loma and Cholla Trail Loop","Saguaro National Park",3.2165,8207.634,57.912
"175",10265889,"South Kaibab, North Kaibab and Bright Angel Trail","Grand Canyon National Park",3.0396,57614.372,2731.9224
"176",10236034,"Cow Head Saddle Trail","Saguaro National Park",2.9406,41842.84,2309.7744
"177",10347968,"Hermit Camp to Monument Creek Camp via Tonto Trail","Grand Canyon National Park",2.8272,10138.842,370.9416
"178",10258658,"Walhalla Ruins","Grand Canyon National Park",2.7978,160.934,0
"179",10022546,"Deer Creek to Colorado River","Grand Canyon National Park",2.6804,29450.922,1792.8336
"180",10267224,"Ironwood Forest Picture Rocks Wash Trail","Saguaro National Park",2.6464,6276.426,83.82
"181",10006893,"Blue Springs Trail","Grand Canyon National Park",2.6336,27358.78,721.7664
"182",10009407,"North Bass Trail","Grand Canyon National Park",2.6173,35888.282,2166.8232
"183",10259364,"South Canyon","Grand Canyon National Park",2.5322,17380.872,991.8192
"184",10014422,"Arizona Trail #36","Grand Canyon National Park",2.4438,27036.912,186.8424
"185",10269033,"South Bass to Hermits Rest via Tonto West","Grand Canyon National Park",2.443,66465.742,2931.8712
"186",10348524,"Encinas Trail from Ez-Kim-In-Zin Picnic Area","Saguaro National Park",2.4255,11748.182,203.9112
"187",10268788,"Tanner and Beamer Trail","Grand Canyon National Park",2.3848,49567.672,2311.908
"188",10268789,"Palisades Creek Trail","Grand Canyon National Park",2.3739,36371.084,1998.8784
"189",10259359,"Powell Plateau Trail","Grand Canyon National Park",2.3699,8046.7,541.9344
"190",10272462,"First Forest Point","Petrified Forest National Park",2.3582,7081.096,87.7824
"191",10261755,"Valley View and Wild Dog Trails","Saguaro National Park",2.33,4345.218,75.8952
"192",10394939,"Shantz, Vanover, Loma Verde, Cholla, Cactus Forest Trail Loop","Saguaro National Park",2.2593,8207.634,37.7952
"193",10007969,"Tiyo Point Trail","Grand Canyon National Park",2.2046,32669.602,503.8344
"194",10366335,"Hugh Norris, Sendero Esperanza, Dobbie Wash Loop","Saguaro National Park",2.005,10299.776,377.952
"195",10453902,"Hope Camp to Grass Shack Camp Trail","Saguaro National Park",1.894,15449.664,839.724
"196",10286475,"AZ Trail Segment 37","Grand Canyon National Park",1.8742,35888.282,304.8
"197",10314641,"Schmutz Spring","Grand Canyon National Park",1.8441,8851.37,560.832
"198",10421252,"Horseshoe Mesa Loop via Grand View Trail","Grand Canyon National Park",1.7209,19633.948,1180.7952
"199",10483525,"Arizona Trail: Savilla Campground to Saguaro National Park","Saguaro National Park",1.6602,13196.588,109.728
"200",10427265,"Thunder River Trail from Indian Hollow Parking Area","Grand Canyon National Park",1.6019,46188.058,1982.724
"201",10258671,"North Bass Trail to Muav Cabin","Grand Canyon National Park",1.5627,2414.01,226.7712
"202",10456484,"Douglas Spring, Converse, Garwood  and Wildhorse Loop","Saguaro National Park",1.0393,5471.756,55.7784
"203",10545419,"Redington Pass Chiva Falls OHV Loop","Saguaro National Park",0,32830.536,941.832
"204",10041922,"Sunset Trail","Hot Springs National Park",12.9365,20921.42,722.9856
"205",10235890,"West Mountain Trail","Hot Springs National Park",12.1636,3057.746,107.8992
"206",10264755,"Goat Rock Trail","Hot Springs National Park",11.2556,3862.416,115.824
"207",10264753,"Gulpha Gorge Trail","Hot Springs National Park",9.7609,1931.208,116.7384
"208",10039426,"The Grand Promenade and Side Trails","Hot Springs National Park",8.5459,1931.208,33.8328
"209",10007938,"Dead Chief Trail","Hot Springs National Park",8.1484,4345.218,121.92
"210",10267800,"Hot Springs Mountain Trail","Hot Springs National Park",7.9948,5310.822,204.8256
"211",10017178,"Peak Trail","Hot Springs National Park",7.7461,2092.142,108.8136
"212",10235889,"Sugarloaf Mountain Via Sunset Trail","Hot Springs National Park",7.1485,11426.314,592.836
"213",10354929,"Goat Rock via Dead Chief Trail","Hot Springs National Park",5.4308,2092.142,87.7824
"214",10264248,"Grand Promenade","Hot Springs National Park",5.3992,1126.538,20.7264
"215",10291742,"Hot Springs Sunset Trail Full Circle","Hot Springs National Park",5.2795,20599.552,680.9232
"216",10307591,"Sunset Trail: Sugarloaf Mountain Section","Hot Springs National Park",5.2031,4667.086,183.7944
"217",10308425,"Upper Dogwood Trail","Hot Springs National Park",3.7307,2253.076,68.8848
"218",10367719,"Mountaintop Loop","Hot Springs National Park",3.3401,2092.142,112.776
"219",10308451,"Lower Dogwood Trail","Hot Springs National Park",3.1454,2574.944,123.7488
"220",10026910,"Vernal and Nevada Falls via the Mist Trail","Yosemite National Park",68.1488,10299.776,667.8168
"221",10005895,"Upper Yosemite Falls Trail","Yosemite National Park",53.628,11587.248,967.74
"222",10005585,"Half Dome Trail","Yosemite National Park",52.5316,23818.232,1573.9872
"224",10011926,"Lower Yosemite Falls Trail","Yosemite National Park",43.3499,1609.34,15.8496
"225",10027503,"Clouds Rest Trail via Tenaya Lake","Yosemite National Park",38.5795,19794.882,948.8424
"226",10010560,"Four Mile Trail","Yosemite National Park",38.2519,12070.05,998.8296
"227",10031426,"Sentinel Dome Trail","Yosemite National Park",37.5768,3379.614,138.9888
"228",10033113,"Glacier Point Trail","Yosemite National Park",37.4664,965.604,71.9328
"229",10276593,"Vernal Falls","Yosemite National Park",37.2129,5954.558,406.908
"230",10011170,"Ryan Mountain Trail","Joshua Tree National Park",37.0218,4828.02,325.8312
"231",10235913,"Mirror Lake via Valley Loop Trail","Yosemite National Park",34.1675,9012.304,101.8032
"233",10028848,"Lassen Peak","Lassen Volcanic National Park",32.6439,8207.634,599.8464
"236",10031888,"Barker Dam Nature Trail","Joshua Tree National Park",30.1796,2896.812,19.812
"238",10235907,"Bridalveil Fall Trail","Yosemite National Park",29.4481,804.67,24.9936
"240",10035554,"Hidden Valley Nature Trail","Joshua Tree National Park",27.9587,1609.34,34.7472
"241",10028653,"Taft Point and The Fissures","Yosemite National Park",27.694,3701.482,113.9952
"244",10002863,"Cathedral Lakes Trail","Yosemite National Park",26.3724,13840.324,472.7448
"245",10003872,"Lost Palms Oasis","Joshua Tree National Park",26.1245,11587.248,312.7248
"246",10010871,"Vernal and Nevada Falls via the Panorama Trail","Yosemite National Park",26.0974,14484.06,297.7896
"247",10013977,"Condor Gulch Trail to High Peaks Trail Loop","Pinnacles National Park",25.0432,8690.436,484.9368
"248",10019827,"Arch Rock Nature Trail","Joshua Tree National Park",24.81,1126.538,7.9248
"249",10235908,"Columbia Rock Trail","Yosemite National Park",24.7999,2092.142,288.9504
"250",10037289,"Porcupine Creek Trail to Indian Ridge Natural Arch to North Dome","Yosemite National Park",24.4063,16737.136,636.7272
"251",10034036,"Fortynine Palms Oasis Trail","Joshua Tree National Park",24.2376,4506.152,188.976
"252",10004781,"John Muir Trail via Yosemite Valley","Yosemite National Park",24.0723,326856.954,14029.944
"253",10031887,"Lost Horse Mine Loop Trail","Joshua Tree National Park",23.7689,11104.446,277.9776
"254",10012390,"Mariposa Grove of Giant Sequoias Trail","Yosemite National Park",23.5256,9012.304,367.8936
"255",10235922,"Chilnualna Falls Trail","Yosemite National Park",23.3042,12713.786,666.9024
"256",10006688,"Badwater Basin Salt Flats Trail","Death Valley National Park",23.0844,2896.812,2.7432
"257",10293225,"Sentinel Dome and Taft Point Loop","Yosemite National Park",22.7858,8207.634,341.9856
"258",10298575,"Nevada Falls","Yosemite National Park",22.0603,8690.436,669.9504
"259",10274952,"Tall Trees Grove Loop Trail","Redwood National Park",21.9301,5310.822,227.9904
"260",10023775,"Skull Rock Nature Trail","Joshua Tree National Park",21.7608,2735.878,48.768
"261",10014345,"Clouds Rest Trail from Yosemite Valley","Yosemite National Park",21.5626,28968.12,1920.8496
"263",10013813,"El Capitan Trail (historical)","Yosemite National Park",21.0807,21726.09,1426.7688
"268",10028648,"Wapama Falls Trail","Yosemite National Park",20.256,7402.964,290.7792
"269",10236017,"Mesquite Flat Sand Dunes Trail","Death Valley National Park",20.2433,4506.152,62.7888
"270",10235899,"Cholla Cactus Garden Nature Trail","Joshua Tree National Park",20.2298,321.868,1.8288
"271",10236155,"Kings Creek Falls Trail","Lassen Volcanic National Park",19.9753,4345.218,143.8656
"272",10261348,"Yosemite Point","Yosemite National Park",19.9437,13679.39,1107.948
"273",10026896,"Tuolumne Grove Trail","Yosemite National Park",19.7137,5149.888,223.7232
"275",10037534,"Lady Bird Johnson Grove Trail","Redwood National Park",19.4001,2092.142,22.86
"277",10029986,"Cinder Cone Nature Trail","Lassen Volcanic National Park",19.1894,7724.832,317.9064
"278",10032060,"Mount Dana Summit Trail","Yosemite National Park",19.0574,11265.38,945.7944
"280",10035907,"Old Pinnacles Trail Loop","Pinnacles National Park",18.9167,15288.73,527.9136
"281",10031884,"Willow Hole Trail","Joshua Tree National Park",18.8592,10943.512,74.9808
"284",10111782,"Mount Hoffman Trail","Yosemite National Park",18.7667,9012.304,582.7776
"286",10033119,"Tenaya Lake Trail","Yosemite National Park",18.544,5471.756,59.7408
"287",10027108,"Brokeoff Mountain Trail","Lassen Volcanic National Park",18.4314,12230.984,786.9936
"288",10034011,"Zabriskie Point","Death Valley National Park",18.3978,643.736,15.8496
"289",10028494,"Mastodon Peak Loop Trail","Joshua Tree National Park",18.2913,3862.416,111.8616
"292",10258341,"Bear Gulch Day Use Area to Reservoir via Rim Trail","Pinnacles National Park",18.2277,2896.812,134.7216
"293",10252968,"Split Rock Loop Trail","Joshua Tree National Park",18.0666,3057.746,76.8096
"294",10235919,"Sentinel Meadow Cook's Meadow Loop Trail","Yosemite National Park",18.0573,3540.548,25.908
"295",10111890,"Black Rock Canyon to Panorama Loop Trail","Joshua Tree National Park",17.7647,10299.776,363.9312
"297",10235927,"Illilouette Falls Trail","Yosemite National Park",17.689,7885.766,442.8744
"298",10027315,"Dante's View Trail","Death Valley National Park",17.5667,2574.944,109.728
"300",10031434,"Tuolumne Meadows to Glen Aulin High Sierra Camp","Yosemite National Park",17.3657,19473.014,365.76
"301",10033216,"Telescope Peak Trail","Death Valley National Park",17.1872,19312.08,1012.8504
"303",10032041,"Hetch Hetchy Trail to Rancheria Falls","Yosemite National Park",16.6842,18185.542,775.716
"304",10243572,"Valley Floor Loop Trail","Yosemite National Park",16.6784,32347.734,370.9416
"305",10011461,"Golden Canyon Trail to Red Cathedral","Death Valley National Park",16.6571,4667.086,174.9552
"306",10006763,"Lembert Dome Loop","Yosemite National Park",16.6277,5954.558,257.8608
"308",10235911,"Inspiration Point Trail","Yosemite National Park",16.4319,3701.482,317.9064
"309",10013938,"High Peaks Trail","Pinnacles National Park",16.1903,10138.842,539.8008
"310",10273406,"Mirror Lake from Shuttle Stop 17","Yosemite National Park",16.0151,3701.482,44.8056
"311",10039812,"Ten Lakes Trail","Yosemite National Park",15.968,19955.816,920.8008
"313",10236157,"Mill Creek Falls Trail","Lassen Volcanic National Park",15.6627,6115.492,237.744
